{
  "fdlVersion": 2,
  "purpose": "design_example",
  "revision": "example:synagogue-r2",
  "parentRevision": "example:synagogue-r1",
  "inputRevision": "example:crew-brief-v1",
  "context": {
    "projectId": "bind:Hatam-Mark-3-project",
    "sceneId": "bind:Mark-3-synagogue-scene",
    "briefSha256": "0000000000000000000000000000000000000000000000000000000000000000"
  },
  "prose": "DESIGN EXAMPLE ONLY. IDs, approvals, coordinates, hashes and timing are illustrative, not live evidence. Mark 3:1–2, inside the synagogue after the entry: a quiet listening moment, no invented words or new arrival. Canon face, hair, build, garment cut/layers/drape, color blocks, tassels and footwear come from exact approved Papuan video versions. The approved first-century Galilean set remains fixed. Keep bodies naturally oriented toward the encounter, readable daylight, no posed portrait. Bench arrangement may be chosen within the existing set constraints; hidden geometry stays unknown. All bind:* and example:* references must be replaced and checked before production. CONTINUATION: K2 inherits the same world, wardrobe, source scope, scene state, lens, light and target. Only camera position changes, from [0,-6,1.6] to [0,-4,1.6]. C1 is an illustrative five-second ease-in/out push, with no subject movement or performance reset. Five seconds is not an asserted Hatam interval. Bind the actual source placement before production. The separate anchor-inspection proposals remain inactive; no image observation has become canon.",
  "world": [
    {
      "id": "jesus",
      "kind": "character",
      "recordRefs": [
        {
          "table": "character_versions",
          "id": "bind:Jesus-approved-version",
          "version": "bind:exact-version-id",
          "snapshotSha256": null
        }
      ],
      "facts": {
        "appearance": {
          "value": "Exact approved face, hair, beard, age, build and silhouette, with supplied head/body references.",
          "units": "none",
          "status": "approved",
          "owner": "casting_canon",
          "reason": "Inherit this exact illustrative baseline; resolve real records before production.",
          "evidence": [
            {
              "ref": "bind:Jesus-canon-approval",
              "limitations": ""
            }
          ],
          "approvalRecord": "bind:Jesus-canon-approval"
        }
      }
    },
    {
      "id": "jesus-garment",
      "kind": "garment",
      "recordRefs": [
        {
          "table": "character_versions",
          "id": "bind:Jesus-approved-version",
          "version": "bind:exact-version-id",
          "snapshotSha256": null
        }
      ],
      "facts": {
        "garment": {
          "value": "Exact approved garment cut, neckline, layers, mantle drape, color blocks, corner tassels and footwear; no garment redesign.",
          "units": "none",
          "status": "approved",
          "owner": "casting_canon",
          "reason": "Inherit this exact illustrative baseline; resolve real records before production.",
          "evidence": [
            {
              "ref": "bind:Jesus-canon-approval",
              "limitations": ""
            }
          ],
          "approvalRecord": "bind:Jesus-canon-approval"
        }
      }
    },
    {
      "id": "withered-hand-man",
      "kind": "character",
      "recordRefs": [
        {
          "table": "character_versions",
          "id": "bind:Man-with-Withered-Hand-version",
          "version": "bind:approved-pre-healing-state-version",
          "snapshotSha256": null
        }
      ],
      "facts": {
        "appearance": {
          "value": "Approved pre-healing identity and visible hand state; no restored hand before the source-supported healing.",
          "units": "none",
          "status": "approved",
          "owner": "casting_canon",
          "reason": "Inherit this exact illustrative baseline; resolve real records before production.",
          "evidence": [
            {
              "ref": "bind:man-canon-story-state-approval",
              "limitations": ""
            }
          ],
          "approvalRecord": "bind:man-canon-story-state-approval"
        }
      }
    },
    {
      "id": "synagogue",
      "kind": "set",
      "recordRefs": [
        {
          "table": "production_runs",
          "id": "bind:shared-scene-space-plan",
          "version": "bind:accepted-plan-revision",
          "snapshotSha256": null
        }
      ],
      "facts": {
        "architecture": {
          "value": "Inherit the approved walls, openings, materials, doorway construction and room scale; no moving windows or new doors.",
          "units": "none",
          "status": "approved",
          "owner": "staging_designer",
          "reason": "Inherit this exact illustrative baseline; resolve real records before production.",
          "evidence": [
            {
              "ref": "bind:shared-scene-space-approval",
              "limitations": ""
            }
          ],
          "approvalRecord": "bind:shared-scene-space-approval"
        },
        "coordinateFrame": {
          "value": "Origin at the planned encounter; +X set-right, +Y toward the rear wall, +Z up. Metres, right-handed. Exact transform comes from the approved set plan.",
          "units": "none",
          "status": "approved",
          "owner": "staging_designer",
          "reason": "Inherit this exact illustrative baseline; resolve real records before production.",
          "evidence": [
            {
              "ref": "example:set-frame-plan",
              "limitations": ""
            }
          ],
          "approvalRecord": "example:set-frame-plan"
        },
        "furnishings": {
          "value": null,
          "units": "none",
          "status": "open",
          "owner": "staging_designer",
          "reason": "Placement of background benches may be chosen within the baseline constraints; inspection will propose visible details.",
          "evidence": [],
          "approvalRecord": null
        },
        "hiddenGeometry": {
          "value": null,
          "units": "none",
          "status": "unknown",
          "owner": "staging_designer",
          "reason": "Unseen room/back-wall geometry has no evidence.",
          "evidence": [],
          "approvalRecord": null
        }
      }
    },
    {
      "id": "bench",
      "kind": "prop",
      "recordRefs": [
        {
          "table": "production_runs",
          "id": "bind:shared-scene-space-plan",
          "version": "bind:accepted-plan-revision",
          "snapshotSha256": null
        }
      ],
      "facts": {
        "material": {
          "value": null,
          "units": "none",
          "status": "open",
          "owner": "staging_designer",
          "reason": "No approved material detail beyond the historical set constraints.",
          "evidence": [],
          "approvalRecord": null
        }
      }
    }
  ],
  "states": [
    {
      "id": "listening",
      "worldIds": [
        "jesus",
        "jesus-garment",
        "withered-hand-man",
        "synagogue",
        "bench"
      ],
      "facts": {
        "jesus.pose": {
          "value": "Inside the established encounter, naturally standing; this pose is staging, not a claim about words absent from Scripture.",
          "units": "none",
          "status": "proposed",
          "owner": "choreographer",
          "reason": "Preserve the source-grounded scene rather than stage another entry.",
          "evidence": [
            {
              "ref": "bind:Mark-3-1-2-source",
              "limitations": ""
            },
            {
              "ref": "example:staging-plan",
              "limitations": ""
            }
          ],
          "approvalRecord": null
        },
        "jesus.gaze": {
          "value": "Toward the man; not camera-facing.",
          "units": "none",
          "status": "proposed",
          "owner": "choreographer",
          "reason": "Keep attention within the encounter.",
          "evidence": [
            {
              "ref": "example:staging-plan",
              "limitations": ""
            }
          ],
          "approvalRecord": null
        },
        "withered-hand-man.pose": {
          "value": "Remain in his established position, with the approved pre-healing hand state.",
          "units": "none",
          "status": "proposed",
          "owner": "choreographer",
          "reason": "No healing or departure occurs in this coverage.",
          "evidence": [
            {
              "ref": "bind:Mark-3-1-2-source",
              "limitations": ""
            }
          ],
          "approvalRecord": null
        },
        "bench.position": {
          "value": null,
          "units": "none",
          "status": "open",
          "owner": "staging_designer",
          "reason": "Only an observed visible relation can be proposed after the anchor; no hidden metric coordinates.",
          "evidence": [],
          "approvalRecord": null
        },
        "light.direction": {
          "value": "Motivated daylight from the existing openings; readable faces and action.",
          "units": "none",
          "status": "proposed",
          "owner": "lighting_designer",
          "reason": "Follow the approved lighting direction across the move.",
          "evidence": [
            {
              "ref": "bind:scene-lighting-direction",
              "limitations": ""
            }
          ],
          "approvalRecord": null
        },
        "timeOfDay": {
          "value": null,
          "units": "none",
          "status": "unknown",
          "owner": "lighting_designer",
          "reason": "The passage does not supply an exact hour.",
          "evidence": [],
          "approvalRecord": null
        },
        "weather": {
          "value": null,
          "units": "none",
          "status": "unknown",